{
  "schema_version": 1,
  "policy": "docs/donor-policy.md",
  "references_directory": "references",
  "donors": [
    {
      "id": "agent-slop-lint",
      "name": "agent-slop-lint",
      "source": "https://github.com/JordanGunn/agent-slop-lint",
      "snapshot": "v1.0.3:d6a80bda0717cb2e3de024430b63bcb203fc9fca",
      "license": "Apache-2.0",
      "license_tier": "permissive_compatible",
      "use_mode": "adapter_first_parity_oracle",
      "runtime_dependency": false,
      "required": false,
      "local_path": "references/agent-slop-lint/src",
      "notes": "Permissive donor with a strict live-oracle adapter. The harness imports the locked checkout through a pre-provisioned Python environment and generates atomic source cases at test time."
    },
    {
      "id": "rust-clippy",
      "name": "Rust Clippy",
      "source": "installed:cargo clippy",
      "snapshot": "operator-installed",
      "license": "MIT OR Apache-2.0",
      "license_tier": "permissive_compatible",
      "use_mode": "installed_optional_oracle",
      "runtime_dependency": false,
      "required": false,
      "notes": "Optional installed oracle for Rust static-analysis calibration; not required for normal scans."
    },
    {
      "id": "ruff",
      "name": "Ruff (Python linter)",
      "source": "https://github.com/astral-sh/ruff",
      "snapshot": "main:e6f1513",
      "license": "MIT",
      "license_tier": "permissive_compatible",
      "use_mode": "algorithm_donor",
      "runtime_dependency": false,
      "required": false,
      "local_path": "references/ruff",
      "notes": "Rust-native Python linter. Adopt complexity algorithm and naming conventions. MIT license permits direct algorithm port."
    },
    {
      "id": "eslint",
      "name": "ESLint (JavaScript/TypeScript linter)",
      "source": "https://github.com/eslint/eslint",
      "snapshot": "main:0493f53",
      "license": "MIT",
      "license_tier": "permissive_compatible",
      "use_mode": "parity_reference",
      "runtime_dependency": false,
      "required": false,
      "local_path": "references/eslint",
      "notes": "Dominant JS/TS linter. Parity reference for EA structural detectors. SonarJS cognitive complexity and import/no-cycle algorithms worth adopting."
    },
    {
      "id": "semgrep",
      "name": "Semgrep (multi-language pattern matching)",
      "source": "https://github.com/semgrep/semgrep",
      "snapshot": "main:816abbf",
      "license": "LGPL-2.1",
      "license_tier": "weak_copyleft_reference_only",
      "use_mode": "parity_reference",
      "runtime_dependency": false,
      "required": false,
      "local_path": "references/semgrep",
      "notes": "Language-parametric pattern engine. Reference only — LGPL-2.1 and OCaml engine make direct porting impractical. Study for future custom-rule feature."
    },
    {
      "id": "pmd",
      "name": "PMD (Java static analysis + CPD)",
      "source": "https://github.com/pmd/pmd",
      "snapshot": "main:e30a701",
      "license": "Apache-2.0",
      "license_tier": "permissive_compatible",
      "use_mode": "algorithm_donor",
      "runtime_dependency": false,
      "required": false,
      "local_path": "references/pmd",
      "notes": "CPD (Copy-Paste Detector) is algorithmically superior to EA's file-fingerprint approach. Adopt token-based duplication detection algorithm."
    },
    {
      "id": "detekt",
      "name": "Detekt (Kotlin static analysis)",
      "source": "https://github.com/detekt/detekt",
      "snapshot": "main:f60d921",
      "license": "Apache-2.0",
      "license_tier": "permissive_compatible",
      "use_mode": "algorithm_donor",
      "runtime_dependency": false,
      "required": false,
      "local_path": "references/detekt",
      "notes": "Cleanest open-source cognitive complexity implementation. Adopt algorithm as a separate EA detector."
    },
    {
      "id": "golangci-lint",
      "name": "Golangci-Lint (Go meta-linter)",
      "source": "https://github.com/golangci/golangci-lint",
      "snapshot": "main:12b97aa",
      "license": "GPL-3.0",
      "license_tier": "strong_copyleft_reference_only",
      "use_mode": "parity_reference",
      "runtime_dependency": false,
      "required": false,
      "local_path": "references/golangci-lint",
      "notes": "GPL-3.0 — no direct porting. Study parallel execution and deduplication architecture only."
    },
    {
      "id": "pylint",
      "name": "Pylint (Python static analysis)",
      "source": "https://github.com/pylint-dev/pylint",
      "snapshot": "main:554b1d1",
      "license": "GPL-2.0",
      "license_tier": "strong_copyleft_reference_only",
      "use_mode": "parity_reference",
      "runtime_dependency": false,
      "required": false,
      "local_path": "references/pylint",
      "notes": "GPL-2.0 — no direct porting. Symilar token-based duplication algorithm may be worth clean-room reimplementation."
    },
    {
      "id": "jscpd",
      "name": "JSCPD (copy-paste detector)",
      "source": "https://github.com/kucherenko/jscpd",
      "snapshot": "master:0d4af2a",
      "license": "MIT",
      "license_tier": "permissive_compatible",
      "use_mode": "algorithm_donor",
      "runtime_dependency": false,
      "required": false,
      "local_path": "references/jscpd",
      "notes": "Token-based duplication detection with per-language tokenizers. MIT license. Adopt algorithm for EA's source_duplicate_group improvement."
    },
    {
      "id": "deptrac",
      "name": "Deptrac (PHP architectural dependency checker)",
      "source": "https://github.com/qossmic/deptrac",
      "snapshot": "main:9fbc71c",
      "license": "MIT",
      "license_tier": "permissive_compatible",
      "use_mode": "algorithm_donor",
      "runtime_dependency": false,
      "required": false,
      "local_path": "references/deptrac",
      "notes": "Architectural layering model is language-agnostic. Adopt concept for EA L4 systems engineering expansion."
    },
    {
      "id": "bandit",
      "name": "Bandit (Python security linter)",
      "source": "https://github.com/PyCQA/bandit",
      "snapshot": "main:3b5e651",
      "license": "Apache-2.0",
      "license_tier": "permissive_compatible",
      "use_mode": "algorithm_donor",
      "runtime_dependency": false,
      "required": false,
      "local_path": "references/bandit",
      "notes": "Security-focused correctness rules. Adopt assert_used, exec_used, eval patterns for EA L1 correctness detectors."
    },
    {
      "id": "import-linter",
      "name": "Import Linter (Python architecture contracts)",
      "source": "https://github.com/seddonym/import-linter",
      "snapshot": "main:f544debbb0efe10092cd387032ea76b94a0acee0",
      "license": "BSD-2-Clause",
      "license_tier": "permissive_compatible",
      "use_mode": "parity_reference",
      "runtime_dependency": false,
      "required": false,
      "local_path": "references/import-linter",
      "notes": "Live version-checked forbidden-layer contract oracle. No source is linked into production crates; atomic parity compares native output on the same generated Python project."
    },
    {
      "id": "dependency-cruiser",
      "name": "Dependency Cruiser (JavaScript/TypeScript architecture rules)",
      "source": "https://github.com/sverweij/dependency-cruiser",
      "snapshot": "main:26dffc05710bc7663315e4d70863dd46c009c48e",
      "license": "MIT",
      "license_tier": "permissive_compatible",
      "use_mode": "parity_reference",
      "runtime_dependency": false,
      "required": false,
      "local_path": "references/dependency-cruiser",
      "notes": "Live version-checked cycle-rule oracle. No source is linked into production crates; atomic parity compares native JSON on the same generated JavaScript project."
    }
  ]
}
